{
  "$schema": "http://json-schema.org/draft-04/schema#",
  "id": "http://justice.gov.uk/core/courts/external/apiLaaReference.json",
  "type": "object",
  "description": "The status of an application for legal aid funding",
  "properties": {
    "applicationReference": {
      "description": "The human readable reference to the application supplied by legal aid agency",
      "type": "string"
    },
    "statusId": {
      "description": "Reference data identifer for the agreed status",
      "$ref": "http://justice.gov.uk/core/courts/external/apiCourtsDefinitions.json#/definitions/uuid"
    },
    "statusCode": {
      "description": "The status code from reference data",
      "type": "string"
    },
    "statusDescription": {
      "description": "The status description from reference data",
      "type": "string"
    },
    "statusDate": {
      "description": "The date that the status was recorded",
      "$ref": "http://justice.gov.uk/core/courts/external/apiCourtsDefinitions.json#/definitions/datePattern"
    },
    "effectiveStartDate": {
      "description": "The start date for legal aid, set when the status represents an approved representation order",
      "$ref": "http://justice.gov.uk/core/courts/external/apiCourtsDefinitions.json#/definitions/datePattern"
    },
    "effectiveEndDate": {
      "description": "The end date for legal aid, set when the status represents an approved representation order",
      "$ref": "http://justice.gov.uk/core/courts/external/apiCourtsDefinitions.json#/definitions/datePattern"
    },
    "offenceLevelStatus": {
      "description": "The defendant level status coming from legal status ref data table",
      "type": "string"
    },
    "laaContractNumber": {
      "description": "this will be null when LAA reference is recorded and will be set when representation order is received",
      "type": "string"
    }
  },
  "required": [
    "applicationReference",
    "statusId",
    "statusCode",
    "statusDescription",
    "statusDate"
  ],
  "additionalProperties": false
}