{
  "applicationReference": "A10000099",
  "statusId": "38944fbb-c8a6-45ff-9b5c-e09e9867eabc",
  "statusCode": "AP",
  "statusDescription": "LAA status description",
  "statusDate": "2020-11-05",
  "effectiveStartDate": "2021-04-10",
  "effectiveEndDate": "2021-04-11",
  "laaContractNumber": "27900"
}
